"question","option_a","option_b","option_c","option_d","correct","difficulty","category","explanation","language"
"Quelle langue est, avec l'anglais, une des deux langues officielles du Cameroun ?","Le portugais","Le français","L'espagnol","L'arabe","B","beginner","culture","Le Cameroun est un pays bilingue : français et anglais sont ses deux langues officielles.","fr"
"Comment surnomme-t-on l'équipe nationale de football du Cameroun ?","Les Éléphants","Les Lions Indomptables","Les Aigles","Les Étalons","B","beginner","culture","L'équipe du Cameroun est surnommée les Lions Indomptables.","fr"
"Quel plat est un mets emblématique de la cuisine camerounaise ?","Le couscous","Le ndolé","Le thiéboudiène","Le mafé","B","beginner","culture","Le ndolé, à base de feuilles amères et d'arachides, est un plat emblématique du Cameroun.","fr"
"Quelle est la monnaie utilisée au Cameroun ?","L'euro","Le franc CFA","Le dollar","Le naira","B","beginner","culture","Le Cameroun utilise le franc CFA d'Afrique centrale (XAF).","fr"
"À quelle famille d'instruments appartient le balafon ?","Les cordes","Les vents","Les percussions","Les claviers","C","beginner","culture","Le balafon est un instrument de percussion à lames, proche du xylophone.","fr"
"Quel écrivain camerounais est l'auteur du roman « Une vie de boy » ?","Mongo Beti","Ferdinand Oyono","Camara Laye","Léopold Sédar Senghor","B","intermediate","culture","« Une vie de boy » (1956) est une œuvre de Ferdinand Oyono.","fr"
"Quelle ville est surnommée la capitale économique du Cameroun ?","Yaoundé","Douala","Bafoussam","Kribi","B","intermediate","culture","Douala, principale ville portuaire, est considérée comme la capitale économique.","fr"
"Le festival Ngondo est célébré par quel groupe de peuples du Cameroun ?","Les Bamiléké","Les Sawa","Les Bamoun","Les Foulbé","B","intermediate","culture","Le Ngondo est le festival traditionnel des peuples Sawa du littoral.","fr"
"Quel artiste camerounais, légende du makossa, a composé « Soul Makossa » ?","Richard Bona","Manu Dibango","Petit Pays","Charlotte Dipanda","B","intermediate","culture","Manu Dibango a popularisé le makossa avec « Soul Makossa ».","fr"
"Combien de régions administratives compte le Cameroun ?","8","10","12","14","B","intermediate","culture","Le Cameroun est divisé en 10 régions administratives.","fr"
"En quelle année Manu Dibango a-t-il sorti le titre « Soul Makossa » ?","1969","1972","1975","1980","B","expert","culture","« Soul Makossa » est sorti en 1972.","fr"
"Quel sultan bamoun a inventé un système d'écriture au début du XXe siècle ?","Ibrahim Njoya","Ahmadou Ahidjo","Rudolf Douala Manga Bell","Ruben Um Nyobè","A","expert","culture","Le sultan Njoya a créé l'écriture bamoun (shü-mom).","fr"
"Quel roman a été écrit par l'auteur camerounais Mongo Beti ?","L'Enfant noir","Le Pauvre Christ de Bomba","Things Fall Apart","Une si longue lettre","B","expert","culture","« Le Pauvre Christ de Bomba » (1956) est une œuvre de Mongo Beti.","fr"
"Le bikutsi est une musique traditionnelle associée à quel groupe du Cameroun ?","Les Beti","Les Douala","Les Bamoun","Les Foulbé","A","expert","culture","Le bikutsi est une danse et musique des peuples Beti du centre-sud.","fr"
"Autour de quel fleuve, à Douala, se déroule le festival Ngondo ?","La Sanaga","Le Wouri","Le Nyong","La Bénoué","B","expert","culture","Le Ngondo se tient sur les rives du Wouri, à Douala.","fr"
"Quelle est la capitale du Cameroun ?","Douala","Yaoundé","Bafoussam","Garoua","B","beginner","geographie","Yaoundé est la capitale politique du Cameroun.","fr"
"Quel océan borde le Cameroun ?","L'océan Indien","L'océan Atlantique","L'océan Pacifique","L'océan Arctique","B","beginner","geographie","Le Cameroun possède une façade sur l'océan Atlantique (golfe de Guinée).","fr"
"Quelle est la capitale de la France ?","Lyon","Paris","Marseille","Bordeaux","B","beginner","geographie","Paris est la capitale de la France.","fr"
"Quel pays voisin du Cameroun a pour capitale Abuja ?","Le Ghana","Le Nigeria","Le Niger","Le Tchad","B","beginner","geographie","Abuja est la capitale du Nigeria, voisin de l'ouest du Cameroun.","fr"
"Quel est le plus grand continent du monde par sa superficie ?","L'Afrique","L'Asie","L'Europe","L'Amérique","B","beginner","geographie","L'Asie est le plus vaste continent.","fr"
"Quel est le point culminant du Cameroun ?","Le mont Cameroun","Le mont Kilimandjaro","Le mont Kenya","Le plateau de l'Adamaoua","A","intermediate","geographie","Le mont Cameroun (~4 040 m) est le plus haut sommet du pays et d'Afrique de l'Ouest.","fr"
"Quel est le plus long fleuve du Cameroun ?","Le Wouri","La Sanaga","Le Nyong","La Bénoué","B","intermediate","geographie","La Sanaga est le plus long fleuve du Cameroun.","fr"
"Avec combien de pays le Cameroun partage-t-il une frontière terrestre ?","4","5","6","7","C","intermediate","geographie","Le Cameroun a 6 voisins : Nigeria, Tchad, RCA, Congo, Gabon et Guinée équatoriale.","fr"
"Quelle est la capitale du Sénégal ?","Bamako","Dakar","Abidjan","Conakry","B","intermediate","geographie","Dakar est la capitale du Sénégal.","fr"
"Le lac Tchad borde le Cameroun, le Tchad, le Niger et quel autre pays ?","Le Mali","Le Nigeria","Le Soudan","La Libye","B","intermediate","geographie","Le lac Tchad est partagé entre le Cameroun, le Tchad, le Niger et le Nigeria.","fr"
"Quelle est l'altitude approximative du mont Cameroun ?","2 900 m","4 040 m","5 200 m","3 000 m","B","expert","geographie","Le mont Cameroun culmine à environ 4 040 mètres.","fr"
"Quelle ville est le chef-lieu de la région du Nord-Ouest du Cameroun ?","Bamenda","Buéa","Bafoussam","Ngaoundéré","A","expert","geographie","Bamenda est le chef-lieu de la région du Nord-Ouest.","fr"
"Quel pays d'Afrique centrale a pour capitale Libreville ?","Le Congo","Le Gabon","La RCA","Le Tchad","B","expert","geographie","Libreville est la capitale du Gabon.","fr"
"Dans quelle ville se trouve le siège de la BEAC, banque centrale d'Afrique centrale ?","Yaoundé","Libreville","Bangui","N'Djamena","A","expert","geographie","La BEAC a son siège à Yaoundé, au Cameroun.","fr"
"Quelle est la capitale de la Guinée équatoriale, voisine du Cameroun ?","Malabo","Bata","Libreville","Douala","A","expert","geographie","Malabo, sur l'île de Bioko, est la capitale de la Guinée équatoriale.","fr"
"En quelle année la partie sous administration française du Cameroun a-t-elle accédé à l'indépendance ?","1958","1960","1962","1972","B","beginner","histoire","Le Cameroun sous tutelle française est devenu indépendant le 1er janvier 1960.","fr"
"Qui fut le premier président du Cameroun ?","Ahmadou Ahidjo","Paul Biya","Ruben Um Nyobè","John Ngu Foncha","A","beginner","histoire","Ahmadou Ahidjo a été le premier président du Cameroun.","fr"
"Quelle puissance européenne a colonisé le Cameroun en premier, à partir de 1884 ?","La France","L'Allemagne","Le Royaume-Uni","La Belgique","B","beginner","histoire","Le Cameroun (Kamerun) fut d'abord une colonie allemande à partir de 1884.","fr"
"Quel jour célèbre-t-on la fête nationale de l'Unité du Cameroun ?","Le 1er janvier","Le 20 mai","Le 11 février","Le 14 juillet","B","beginner","histoire","La fête de l'Unité est célébrée le 20 mai.","fr"
"Sur quel continent se trouvait l'Égypte antique, célèbre pour ses pyramides ?","L'Asie","L'Afrique","L'Europe","L'Amérique","B","beginner","histoire","L'Égypte antique se situe en Afrique du Nord-Est.","fr"
"Comment s'appelait le mouvement nationaliste dirigé par Ruben Um Nyobè ?","L'UPC","Le RDPC","Le SDF","L'UNC","A","intermediate","histoire","Ruben Um Nyobè dirigeait l'Union des Populations du Cameroun (UPC).","fr"
"En quelle année a eu lieu la réunification des Cameroun oriental et occidental ?","1960","1961","1972","1984","B","intermediate","histoire","La réunification a eu lieu le 1er octobre 1961.","fr"
"Quel empire médiéval ouest-africain était célèbre pour son commerce de l'or sous Mansa Moussa ?","L'Empire du Ghana","L'Empire du Mali","L'Empire Songhaï","Le Royaume du Bénin","B","intermediate","histoire","Mansa Moussa régnait sur l'Empire du Mali, réputé pour ses richesses en or.","fr"
"Quel poète de la Négritude fut le premier président du Sénégal ?","Léopold Sédar Senghor","Kwame Nkrumah","Aimé Césaire","Modibo Keïta","A","intermediate","histoire","Léopold Sédar Senghor, poète de la Négritude, fut le premier président du Sénégal.","fr"
"Sous quel nom le Cameroun est-il devenu un État unitaire en 1972 ?","La République Unie du Cameroun","La République fédérale","La République populaire","L'Union camerounaise","A","intermediate","histoire","Le référendum de 1972 a donné naissance à la République Unie du Cameroun.","fr"
"En quelle année Ruben Um Nyobè a-t-il été tué ?","1955","1958","1960","1962","B","expert","histoire","Ruben Um Nyobè a été tué en 1958.","fr"
"Quel chef Douala a été exécuté par les Allemands en 1914 pour résistance ?","Rudolf Douala Manga Bell","Martin-Paul Samba","Ruben Um Nyobè","Charles Atangana","A","expert","histoire","Rudolf Douala Manga Bell a été exécuté par l'administration allemande en 1914.","fr"
"Après la Première Guerre mondiale, le Cameroun allemand fut partagé entre la France et quel autre pays ?","La Belgique","Le Royaume-Uni","Le Portugal","L'Espagne","B","expert","histoire","Sous mandat de la SDN, le territoire fut partagé entre la France et le Royaume-Uni.","fr"
"En quelle année Paul Biya est-il devenu président du Cameroun ?","1975","1982","1984","1990","B","expert","histoire","Paul Biya est devenu président le 6 novembre 1982.","fr"
"Quel royaume de l'actuel Nigeria était réputé pour ses bronzes sculptés ?","Le royaume du Bénin","L'Empire du Ghana","Le royaume du Kongo","L'Empire Ashanti","A","expert","histoire","Le royaume du Bénin est célèbre pour ses bronzes.","fr"
"Quelle organisation regroupe le Cameroun et 5 autres pays d'Afrique centrale autour d'une monnaie commune ?","La CEDEAO","La CEMAC","L'UEMOA","La SADC","B","beginner","industrie","La CEMAC réunit 6 pays d'Afrique centrale partageant le franc CFA.","fr"
"Quelle fève brune, exportée par le Cameroun, sert à fabriquer le chocolat ?","Le café","Le cacao","Le coton","Le thé","B","beginner","industrie","Le cacao est l'une des principales exportations agricoles du Cameroun.","fr"
"Quel opérateur de téléphonie mobile présent au Cameroun est d'origine sud-africaine ?","Orange","MTN","Nexttel","Camtel","B","beginner","industrie","MTN est un opérateur d'origine sud-africaine.","fr"
"Comment paie-t-on couramment au Cameroun à l'aide de son téléphone ?","Le Mobile Money","Le chèque","Le virement SWIFT","La lettre de change","A","beginner","industrie","Le Mobile Money (MTN MoMo, Orange Money) est très répandu au Cameroun.","fr"
"Quelle ressource naturelle est exploitée au large des côtes camerounaises ?","Le pétrole","Le charbon","L'uranium","Le diamant","A","beginner","industrie","Le Cameroun exploite du pétrole offshore.","fr"
"Quel est le principal port maritime historique du Cameroun ?","Douala","Kribi","Limbé","Garoua","A","intermediate","industrie","Le port de Douala est le principal port du pays.","fr"
"Quelle entreprise publique gère les télécommunications historiques au Cameroun ?","CAMTEL","CAMAIR","SONARA","ENEO","A","intermediate","industrie","CAMTEL est l'opérateur historique des télécommunications.","fr"
"Dans quelle ville se trouve la raffinerie SONARA ?","Limbé","Douala","Kribi","Garoua","A","intermediate","industrie","La SONARA est implantée à Limbé.","fr"
"Quelle est la monnaie commune des pays de la CEMAC ?","Le franc CFA","Le naira","Le cedi","Le dirham","A","intermediate","industrie","Les pays de la CEMAC utilisent le franc CFA d'Afrique centrale.","fr"
"Quelle entreprise assure la distribution d'électricité au Cameroun ?","ENEO","SONARA","CAMWATER","CAMTEL","A","intermediate","industrie","ENEO distribue l'électricité au Cameroun.","fr"
"Combien d'États membres compte la CEMAC ?","5","6","7","8","B","expert","industrie","La CEMAC compte 6 États : Cameroun, Gabon, Congo, Tchad, RCA et Guinée équatoriale.","fr"
"Quelle institution émet le franc CFA d'Afrique centrale ?","La BEAC","La BCEAO","Le FMI","La Banque mondiale","A","expert","industrie","La BEAC émet le franc CFA pour l'Afrique centrale ; la BCEAO le fait pour l'Afrique de l'Ouest.","fr"
"Quelle ville camerounaise accueille un port en eau profonde mis en service dans les années 2010 ?","Kribi","Douala","Limbé","Tiko","A","expert","industrie","Le port en eau profonde de Kribi est entré en activité à la fin des années 2010.","fr"
"Quel est le code ISO 4217 de la monnaie du Cameroun ?","XAF","XOF","CFA","CMR","A","expert","industrie","XAF est le code du franc CFA d'Afrique centrale ; XOF concerne l'Afrique de l'Ouest.","fr"
"Outre le cacao, le café et le bois, quel produit figure parmi les principales exportations camerounaises ?","Le pétrole","L'or","Le diamant","L'uranium","A","expert","industrie","Le pétrole figure parmi les premières exportations du Cameroun.","fr"
"Quel sport est de loin le plus populaire au Cameroun ?","Le football","Le rugby","Le cricket","Le golf","A","beginner","culture","Le football est le sport le plus populaire et le plus pratiqué au Cameroun.","fr"
"Combien de langues officielles le Cameroun possède-t-il ?","Une","Deux","Trois","Quatre","B","beginner","culture","Le Cameroun a deux langues officielles : le français et l'anglais.","fr"
"Le makossa est un genre musical originaire de quel pays ?","Le Sénégal","Le Mali","Le Cameroun","Le Nigeria","C","beginner","culture","Le makossa est un genre musical né au Cameroun, notamment à Douala.","fr"
"Roger Milla est une légende camerounaise de quel sport ?","Le basketball","L'athlétisme","La natation","Le football","D","beginner","culture","Roger Milla est un footballeur camerounais de légende.","fr"
"Quel aliment de base est souvent frit ou bouilli dans la cuisine camerounaise ?","La banane plantain","Le quinoa","Le blé","Le seigle","A","beginner","culture","La banane plantain est un aliment de base très consommé au Cameroun.","fr"
"Comment appelle-t-on les brochettes de viande épicées vendues dans la rue au Cameroun ?","Le yassa","Le soya","Le mafé","Le tiep","B","beginner","culture","Les brochettes de viande épicées vendues en rue sont appelées « soya ».","fr"
"Quelle ville est considérée comme le berceau de la musique makossa ?","Garoua","Maroua","Douala","Ebolowa","C","beginner","culture","Douala est considérée comme le berceau du makossa.","fr"
"Quelles sont les trois couleurs du drapeau camerounais ?","Bleu, blanc, rouge","Noir, jaune, rouge","Vert, blanc, orange","Vert, rouge, jaune","D","beginner","culture","Le drapeau du Cameroun est vert, rouge et jaune.","fr"
"Quel symbole figure au centre du drapeau camerounais ?","Une étoile","Un lion","Un aigle","Un soleil","A","beginner","culture","Une étoile d'or figure au centre de la bande rouge du drapeau.","fr"
"Quel mets à base de feuilles d'okok (gnetum) est apprécié au Cameroun ?","Le yassa","L'eru","Le mafé","Le thiéboudiène","B","beginner","culture","L'eru, à base de feuilles d'okok, est un plat apprécié, notamment dans le Sud-Ouest.","fr"
"Surnommé « le Turbo d'Afrique », quel chanteur est une star du makossa ?","Lapiro de Mbanga","Longuè Longuè","Petit Pays","Ben Decca","C","intermediate","culture","Petit Pays, surnommé « le Turbo d'Afrique », est une star du makossa.","fr"
"Francis Bebey, Camerounais célèbre, était à la fois musicien et… ?","Footballeur","Peintre","Architecte","Écrivain","D","intermediate","culture","Francis Bebey était à la fois musicien et écrivain.","fr"
"Combien de fois le Cameroun avait-il remporté la Coupe d'Afrique des Nations à l'issue de 2017 ?","Cinq","Trois","Quatre","Six","A","intermediate","culture","Le Cameroun a gagné la CAN cinq fois : 1984, 1988, 2000, 2002 et 2017.","fr"
"Quel footballeur camerounais a été élu plusieurs fois meilleur joueur africain dans les années 2000 ?","Roger Milla","Samuel Eto'o","Rigobert Song","Joseph-Antoine Bell","B","intermediate","culture","Samuel Eto'o a été élu plusieurs fois meilleur joueur africain.","fr"
"Charlotte Dipanda est une artiste camerounaise connue comme… ?","Romancière","Peintre","Chanteuse","Cinéaste","C","intermediate","culture","Charlotte Dipanda est une chanteuse camerounaise.","fr"
"Quel roman, outre « Une vie de boy », a été écrit par Ferdinand Oyono ?","Ville cruelle","Le Pauvre Christ de Bomba","Trois prétendants… un mari","Le Vieux Nègre et la médaille","D","intermediate","culture","« Le Vieux Nègre et la médaille » est une œuvre de Ferdinand Oyono.","fr"
"Qui a écrit la pièce de théâtre « Trois prétendants… un mari » ?","Guillaume Oyônô Mbia","Mongo Beti","Calixthe Beyala","Ferdinand Oyono","A","intermediate","culture","« Trois prétendants… un mari » est une pièce de Guillaume Oyônô Mbia.","fr"
"Calixthe Beyala est une figure camerounaise célèbre dans quel domaine ?","La musique","La littérature","Le cinéma","La peinture","B","intermediate","culture","Calixthe Beyala est une romancière camerounaise.","fr"
"De quel instrument Manu Dibango était-il un virtuose ?","La guitare","Le piano","Le saxophone","La trompette","C","intermediate","culture","Manu Dibango était un grand saxophoniste.","fr"
"Quelle ville de l'Ouest est réputée pour son artisanat d'art et le palais des Bamoun ?","Dschang","Bafang","Mbouda","Foumban","D","intermediate","culture","Foumban, capitale du royaume Bamoun, est réputée pour son artisanat d'art.","fr"
"Le sultan Njoya régnait sur quel royaume de l'Ouest camerounais ?","Le royaume Bamoun","Le royaume Bamiléké","Le royaume Tikar","Le royaume Douala","A","expert","culture","Njoya était le souverain du royaume Bamoun, à Foumban.","fr"
"Avec quel club Samuel Eto'o a-t-il remporté la Ligue des champions en 2009 ?","L'Inter Milan","Le FC Barcelone","Chelsea","Le Real Madrid","B","expert","culture","Eto'o a gagné la Ligue des champions 2009 avec le FC Barcelone.","fr"
"Quelle équipe le Cameroun a-t-il battue en finale de la CAN 2017 ?","Le Sénégal","Le Ghana","L'Égypte","Le Nigeria","C","expert","culture","Le Cameroun a battu l'Égypte en finale de la CAN 2017.","fr"
"Lors de la Coupe du monde 1990, contre quelle équipe le Cameroun a-t-il perdu en quart de finale ?","L'Italie","L'Argentine","L'Allemagne","L'Angleterre","D","expert","culture","Le Cameroun a perdu contre l'Angleterre en quart de finale en 1990.","fr"
"Sous quel pseudonyme Mongo Beti a-t-il publié « Ville cruelle » ?","Eza Boto","Eno Belinga","Sengat Kuo","Mongo Awala","A","expert","culture","Mongo Beti a publié « Ville cruelle » sous le pseudonyme Eza Boto.","fr"
"Dans quelle ville est né le musicien Manu Dibango ?","Yaoundé","Douala","Édéa","Nkongsamba","B","expert","culture","Manu Dibango est né à Douala en 1933.","fr"
"Quel groupe a popularisé le bikutsi moderne à la guitare électrique dans les années 1980 ?","Magic System","Extra Musica","Les Têtes Brûlées","Les Nubians","C","expert","culture","Les Têtes Brûlées ont modernisé le bikutsi à la guitare électrique.","fr"
"Quel écrivain camerounais a écrit « Le Fils d'Agatha Moudio » ?","Mongo Beti","Ferdinand Oyono","Calixthe Beyala","Francis Bebey","D","expert","culture","« Le Fils d'Agatha Moudio » (1967) est de Francis Bebey.","fr"
"Quel défenseur camerounais a longtemps détenu le record de sélections et capitainé les Lions ?","Rigobert Song","Samuel Eto'o","Geremi Njitap","Stephen Tataw","A","expert","culture","Rigobert Song a capitainé les Lions Indomptables et détenu le record de sélections.","fr"
"Werewere Liking est une artiste camerounaise reconnue notamment comme… ?","Architecte","Dramaturge et romancière","Cheffe d'orchestre","Cinéaste d'animation","B","expert","culture","Werewere Liking est dramaturge, romancière et plasticienne.","fr"
"Quelle est la plus grande ville du Cameroun par sa population ?","Yaoundé","Bamenda","Douala","Garoua","C","beginner","geographie","Douala est la ville la plus peuplée du Cameroun.","fr"
"Dans quelle partie de l'Afrique se situe le Cameroun ?","Afrique du Nord","Afrique australe","Afrique de l'Est","Afrique centrale","D","beginner","geographie","Le Cameroun se situe en Afrique centrale.","fr"
"Quel surnom géographique donne-t-on au Cameroun pour sa diversité ?","L'Afrique en miniature","Le toit de l'Afrique","La corne de l'Afrique","Le grenier de l'Afrique","A","beginner","geographie","Le Cameroun est surnommé « l'Afrique en miniature ».","fr"
"Quel climat domine l'extrême-nord du Cameroun ?","Un climat polaire","Un climat sahélien sec","Un climat méditerranéen","Un climat équatorial humide","B","beginner","geographie","L'Extrême-Nord a un climat sahélien, chaud et sec.","fr"
"Quelle est la capitale des États-Unis ?","New York","Los Angeles","Washington","Chicago","C","beginner","geographie","Washington D.C. est la capitale des États-Unis.","fr"
"Quel est le plus grand désert chaud du monde, situé en Afrique ?","Le Kalahari","Le Namib","Le Gobi","Le Sahara","D","beginner","geographie","Le Sahara est le plus grand désert chaud du monde.","fr"
"Quel fleuve d'Afrique est souvent cité parmi les plus longs du monde ?","Le Nil","La Seine","Le Rhin","La Tamise","A","beginner","geographie","Le Nil, en Afrique, est l'un des plus longs fleuves du monde.","fr"
"Quelle ville côtière camerounaise est connue pour ses plages ?","Bertoua","Kribi","Ngaoundéré","Bafoussam","B","beginner","geographie","Kribi est réputée pour ses plages sur l'océan Atlantique.","fr"
"Dans quelle région se trouve Yaoundé ?","La région du Littoral","La région de l'Ouest","La région du Centre","La région du Sud","C","beginner","geographie","Yaoundé est située dans la région du Centre.","fr"
"Dans quelle région se trouve Douala ?","Le Centre","L'Ouest","Le Sud-Ouest","Le Littoral","D","beginner","geographie","Douala est le chef-lieu de la région du Littoral.","fr"
"Quelle ville est le chef-lieu de la région de l'Ouest ?","Bafoussam","Dschang","Bandjoun","Mbouda","A","intermediate","geographie","Bafoussam est le chef-lieu de la région de l'Ouest.","fr"
"Quel est le chef-lieu de la région du Sud ?","Kribi","Ebolowa","Sangmélima","Mbalmayo","B","intermediate","geographie","Ebolowa est le chef-lieu de la région du Sud.","fr"
"Quel est le chef-lieu de la région de l'Adamaoua ?","Garoua","Maroua","Ngaoundéré","Tibati","C","intermediate","geographie","Ngaoundéré est le chef-lieu de la région de l'Adamaoua.","fr"
"Quel est le chef-lieu de la région de l'Extrême-Nord ?","Garoua","Kousséri","Mokolo","Maroua","D","intermediate","geographie","Maroua est le chef-lieu de la région de l'Extrême-Nord.","fr"
"Quel est le chef-lieu de la région du Nord ?","Garoua","Maroua","Ngaoundéré","Guider","A","intermediate","geographie","Garoua est le chef-lieu de la région du Nord.","fr"
"Quel est le chef-lieu de la région du Sud-Ouest ?","Limbé","Buéa","Kumba","Mamfé","B","intermediate","geographie","Buéa est le chef-lieu de la région du Sud-Ouest.","fr"
"Quel est le chef-lieu de la région de l'Est ?","Abong-Mbang","Batouri","Bertoua","Yokadouma","C","intermediate","geographie","Bertoua est le chef-lieu de la région de l'Est.","fr"
"Sur l'estuaire de quel fleuve la ville de Douala est-elle bâtie ?","La Sanaga","Le Nyong","Le Mungo","Le Wouri","D","intermediate","geographie","Douala est bâtie sur l'estuaire du Wouri.","fr"
"La Bénoué, fleuve du nord du Cameroun, est un affluent de quel grand fleuve ?","Le Niger","Le Congo","Le Nil","Le Sénégal","A","intermediate","geographie","La Bénoué est un affluent du fleuve Niger.","fr"
"Quel plateau du Cameroun est surnommé le « château d'eau » du pays ?","Les monts Mandara","Le plateau de l'Adamaoua","Le mont Cameroun","Le plateau Bamiléké","B","intermediate","geographie","Le plateau de l'Adamaoua, d'où partent plusieurs fleuves, est le château d'eau du pays.","fr"
"Quel lac du Cameroun a connu une éruption limnique mortelle en 1986 ?","Le lac Tchad","Le lac Ossa","Le lac Nyos","Le lac Barombi","C","expert","geographie","Le lac Nyos a libéré un nuage de CO2 en 1986, faisant de nombreuses victimes.","fr"
"Le mont Cameroun est un volcan de quel type ?","Un volcan éteint","Une simple colline","Un volcan sous-marin","Un volcan actif","D","expert","geographie","Le mont Cameroun est un volcan actif, entré en éruption à plusieurs reprises.","fr"
"La « ligne du Cameroun » est une chaîne de quel type de reliefs ?","Volcaniques","Glaciaires","Sédimentaires plissés","Coralliens","A","expert","geographie","La ligne du Cameroun est un alignement de reliefs volcaniques.","fr"
"Quel parc national du Sud-Ouest protège l'une des plus anciennes forêts tropicales d'Afrique ?","Le parc de Waza","Le parc de Korup","Le parc de la Bénoué","Le parc de Campo-Ma'an","B","expert","geographie","Le parc national de Korup abrite une forêt tropicale très ancienne.","fr"
"Quel parc national de l'Extrême-Nord est célèbre pour ses éléphants et ses lions ?","Le parc de Korup","Le parc de Lobéké","Le parc de Waza","Le parc de Mbam et Djerem","C","expert","geographie","Le parc de Waza, en zone sahélienne, est réputé pour sa faune.","fr"
"Lequel de ces pays ne partage PAS de frontière avec le Cameroun ?","Le Tchad","Le Gabon","Le Congo","Le Soudan","D","expert","geographie","Le Soudan ne borde pas le Cameroun ; ses voisins sont le Nigeria, le Tchad, la RCA, le Congo, le Gabon et la Guinée équatoriale.","fr"
